{
  "schema_version": "xa.frontend-experience.v1",
  "profile_id": "platform-operator-control-room",
  "portal_context": {
    "portal_kind": "platform_operator",
    "identity": {"identity_id": "id-platform-7", "platform_authority": true},
    "membership": {"tenant_id": null, "membership_id": null},
    "structural_context": {"scope_type": "platform", "organization_unit_id": null, "legal_entity_id": null, "location_id": null},
    "locale": "en-GB", "timezone": "UTC", "business_date": {"value": "2026-08-13", "source_authority": "PC4"},
    "active_modules": ["tenant_governance", "security_authority"],
    "capabilities": ["tenant.read", "security.audit.read"]
  },
  "navigation": [{
    "route_id": "platform.tenants", "path_template": "/platform/tenants", "module": "tenant_governance", "visible": true,
    "permission": "platform.tenant.read", "entitlement": null, "feature_flag": null, "profiles": ["platform-operator-control-room"], "can_invoke": true,
    "authorization": {"decision": "allow", "reason_code": "AUTHORIZED", "explanation": "Platform-scoped assignment permits the read operation.", "source_authority": "PC5"}
  }],
  "configuration": [{
    "key": "platform.locale", "field_type": "locale", "scope": "platform", "effective_value": "en-GB", "value_source": "platform_default", "inherited": false, "editable": true,
    "validation": {"required": true, "allowed": ["en-GB", "fr-FR"]}, "terminology_key": "settings.locale", "secret": false, "value_exposed": true
  }],
  "actions": [{
    "action_id": "tenant.review", "source_authority": "PA", "from_states": ["submitted"], "to_state": "reviewed", "required_permission": "platform.tenant.review",
    "approval": null, "step_up": null, "execution": {"mode": "synchronous", "offline": "online_only"},
    "authorization": {"decision": "allow", "reason_code": "AUTHORIZED", "explanation": "Platform review permission is present.", "source_authority": "PC5"}
  }],
  "work_queue": [{"work_item_id": "work-platform-1", "type": "tenant_review", "priority": "high", "assignee": "id-platform-7", "scope": {"type": "platform", "id": null}, "status": "open", "due_at": "2026-08-14T12:00:00Z", "available_actions": ["tenant.review"], "source_authority": "SO"}],
  "dashboard": [{"widget_id": "tenant-review-summary", "projection": true, "source_authority": "SO", "refresh": {"mode": "poll", "seconds": 60}, "as_of": "2026-08-13T12:00:00Z", "permission_filter": "platform.tenant.read", "states": ["empty", "error", "stale", "ready"]}],
  "documents": [{"document_id": "doc-platform-1", "document_type": "tenant_review_evidence", "rendering": {"media_type": "application/pdf", "download_name": "review.pdf"}, "allowed_actions": ["view"], "permission_reference": "platform.tenant.read", "evidence_references": ["evidence:review:1"], "source_authority": "SO7"}],
  "search": [{"result_id": "tenant:northstar", "category": "tenant", "tenant_id": null, "scope": {"type": "platform", "id": null}, "permitted_actions": ["tenant.review"], "source_authority": "PC1", "authorization": {"decision": "allow", "reason_code": "AUTHORIZED", "explanation": "Platform tenant search is authorized.", "source_authority": "PC5"}}],
  "offline": [{"operation_id": "platform.tenant.read", "mode": "online_only", "server_truth": "PC1", "conflict_state": null, "retry": null, "idempotency": false}],
  "composition": {"template_profile_reference": "future-pk:platform-control-room", "terminology": {"tenant": "Merchant"}, "layout_regions": ["global-navigation", "work-area"], "module_slots": ["tenant-governance", "audit"], "engine_implemented": false},
  "frontend_authorities": []
}
